{
 "schema": "now/1",
 "license": "CC BY-SA 4.0",
 "attribution": "Radar-DPC (CC BY-SA 4.0); METAR: NOAA Aviation Weather Center",
 "generated_at": "2026-10-24T12:51:00Z",
 "town": "pedrengo",
 "reference": {
  "name": "Torre Boldone",
  "distance_km": 3.4
 },
 "metar": {
  "icao": "LIME",
  "name": "Bergamo Orio al Serio",
  "distance_km": 4.3,
  "observed_at": "2026-10-24T12:50:00Z",
  "temperature_c": 13,
  "dew_point_c": null,
  "wind_kmh": 15,
  "wind_dir_deg": 210,
  "gust_kmh": null,
  "visibility_m": null,
  "weather": "-RA BR",
  "stale_after_min": 90
 },
 "radar": null
}
