{
 "schema": "now/1",
 "license": "CC BY-SA 4.0",
 "attribution": "Radar-DPC (CC BY-SA 4.0); METAR: NOAA Aviation Weather Center",
 "generated_at": "2026-10-24T13:06:00Z",
 "town": "pedrengo",
 "reference": {
  "name": "Torre Boldone",
  "distance_km": 3.4
 },
 "metar": {
  "icao": "LIME",
  "name": "Bergamo Orio al Serio",
  "distance_km": 4.3,
  "observed_at": "2026-10-24T12:50:00Z",
  "temperature_c": 17,
  "dew_point_c": 8,
  "wind_kmh": 6,
  "wind_dir_deg": null,
  "gust_kmh": null,
  "visibility_m": 9999,
  "weather": null,
  "stale_after_min": 90,
  "raw": "LIME 241250Z VRB03KT 9999 FEW040 17/08 Q1027",
  "cloud_cover": "FEW"
 },
 "radar": {
  "frame_time": "2026-10-24T13:05:00Z",
  "rate_mm_h": 0,
  "max_5km_mm_h": 0,
  "max_10km_mm_h": 0,
  "no_data": false,
  "stale_after_min": 15
 }
}
